[
  {
    "id": "eval-001",
    "input": {
      "text": "The RBI increased the repo rate by 50 basis points in June 2023.",
      "language": "en"
    },
    "expected": {
      "claim_types": [
        "checkable_fact"
      ],
      "veracity": "supported",
      "route_to_human": false
    },
    "bucket": "true",
    "synthetic": true,
    "notes": "Verifiable monetary-policy statement with quantity and time."
  },
  {
    "id": "eval-002",
    "input": {
      "text": "ISRO launched Chandrayaan-3 in July 2023.",
      "language": "en"
    },
    "expected": {
      "claim_types": [
        "checkable_fact"
      ],
      "veracity": "supported",
      "route_to_human": false
    },
    "bucket": "true",
    "synthetic": true,
    "notes": "Verifiable space-programme event."
  },
  {
    "id": "eval-003",
    "input": {
      "text": "सरकार ने 2021 में पीएम-किसान योजना के तहत 2000 रुपये की किस्त जारी की।",
      "language": "hi"
    },
    "expected": {
      "claim_types": [
        "checkable_fact"
      ],
      "veracity": "supported",
      "route_to_human": false
    },
    "bucket": "true",
    "synthetic": true,
    "notes": "Hindi checkable fact with quantity and time."
  },
  {
    "id": "eval-004",
    "input": {
      "text": "Delhi recorded 40 degrees Celsius in May 2024.",
      "language": "en"
    },
    "expected": {
      "claim_types": [
        "checkable_fact"
      ],
      "veracity": "supported",
      "route_to_human": false
    },
    "bucket": "true",
    "synthetic": true,
    "notes": "Weather record claim with quantity and time."
  },
  {
    "id": "eval-005",
    "input": {
      "text": "The monsoon session of Parliament began on Monday in New Delhi.",
      "language": "en"
    },
    "expected": {
      "claim_types": [
        "checkable_fact"
      ],
      "veracity": "supported",
      "route_to_human": false
    },
    "bucket": "true",
    "synthetic": true,
    "notes": "Institutional schedule claim."
  },
  {
    "id": "eval-006",
    "input": {
      "text": "According to Reuters, India won 7 medals at the Tokyo Olympics.",
      "language": "en"
    },
    "expected": {
      "claim_types": [
        "checkable_fact"
      ],
      "veracity": "supported",
      "route_to_human": false
    },
    "bucket": "true",
    "synthetic": true,
    "notes": "Authority-attributed statistic."
  },
  {
    "id": "eval-007",
    "input": {
      "text": "बिहार विधानसभा में 243 सीटें हैं।",
      "language": "hi"
    },
    "expected": {
      "claim_types": [
        "checkable_fact"
      ],
      "veracity": "supported",
      "route_to_human": false
    },
    "bucket": "true",
    "synthetic": true,
    "notes": "Hindi constitutional fact."
  },
  {
    "id": "eval-008",
    "input": {
      "text": "The rupee crossed 83 per US dollar in October 2022.",
      "language": "en"
    },
    "expected": {
      "claim_types": [
        "checkable_fact"
      ],
      "veracity": "supported",
      "route_to_human": false
    },
    "bucket": "true",
    "synthetic": true,
    "notes": "Market record claim."
  },
  {
    "id": "eval-009",
    "input": {
      "text": "Railways announced 200 new Vande Bharat services in the 2024 budget.",
      "language": "en"
    },
    "expected": {
      "claim_types": [
        "checkable_fact"
      ],
      "veracity": "supported",
      "route_to_human": false
    },
    "bucket": "true",
    "synthetic": true,
    "notes": "Budget announcement claim."
  },
  {
    "id": "eval-010",
    "input": {
      "text": "WHO declared the end of the COVID-19 emergency in May 2023.",
      "language": "en"
    },
    "expected": {
      "claim_types": [
        "checkable_fact"
      ],
      "veracity": "supported",
      "route_to_human": false
    },
    "bucket": "true",
    "synthetic": true,
    "notes": "Institutional declaration with time."
  },
  {
    "id": "eval-011",
    "input": {
      "text": "The scheme has 10 crore beneficiaries, according to the ministry.",
      "language": "en"
    },
    "expected": {
      "claim_types": [
        "checkable_fact"
      ],
      "veracity": "mostly supported",
      "route_to_human": false
    },
    "bucket": "mostly_true",
    "synthetic": true,
    "notes": "Right order of magnitude, exact figure disputed."
  },
  {
    "id": "eval-012",
    "input": {
      "text": "India's UPI handled 10 billion transactions in one month in 2023.",
      "language": "en"
    },
    "expected": {
      "claim_types": [
        "checkable_fact"
      ],
      "veracity": "mostly supported",
      "route_to_human": false
    },
    "bucket": "mostly_true",
    "synthetic": true,
    "notes": "Rounded figure close to official data."
  },
  {
    "id": "eval-013",
    "input": {
      "text": "मुंबई में मेट्रो लाइन 2023 में खुली।",
      "language": "hi"
    },
    "expected": {
      "claim_types": [
        "checkable_fact"
      ],
      "veracity": "mostly supported",
      "route_to_human": false
    },
    "bucket": "mostly_true",
    "synthetic": true,
    "notes": "Correct line, off by one phase detail."
  },
  {
    "id": "eval-014",
    "input": {
      "text": "The hospital opened 500 new beds last year.",
      "language": "en"
    },
    "expected": {
      "claim_types": [
        "checkable_fact"
      ],
      "veracity": "mostly supported",
      "route_to_human": false
    },
    "bucket": "mostly_true",
    "synthetic": true,
    "notes": "Approximate institutional figure."
  },
  {
    "id": "eval-015",
    "input": {
      "text": "Punjab gives 300 units of free electricity per month.",
      "language": "en"
    },
    "expected": {
      "claim_types": [
        "checkable_fact"
      ],
      "veracity": "mostly supported",
      "route_to_human": false
    },
    "bucket": "mostly_true",
    "synthetic": true,
    "notes": "Policy exists, eligibility caveats omitted."
  },
  {
    "id": "eval-016",
    "input": {
      "text": "The flight was delayed by 3 hours on Friday.",
      "language": "en"
    },
    "expected": {
      "claim_types": [
        "checkable_fact"
      ],
      "veracity": "mostly supported",
      "route_to_human": false
    },
    "bucket": "mostly_true",
    "synthetic": true,
    "notes": "Small rounding in delay duration."
  },
  {
    "id": "eval-017",
    "input": {
      "text": "The app has 50 million downloads on the Play Store.",
      "language": "en"
    },
    "expected": {
      "claim_types": [
        "checkable_fact"
      ],
      "veracity": "mostly supported",
      "route_to_human": false
    },
    "bucket": "mostly_true",
    "synthetic": true,
    "notes": "Bracketed store figure, not exact."
  },
  {
    "id": "eval-018",
    "input": {
      "text": "The college admitted 2000 students in 2024.",
      "language": "en"
    },
    "expected": {
      "claim_types": [
        "checkable_fact"
      ],
      "veracity": "mostly supported",
      "route_to_human": false
    },
    "bucket": "mostly_true",
    "synthetic": true,
    "notes": "Institutional figure with minor discrepancy."
  },
  {
    "id": "eval-019",
    "input": {
      "text": "The home minister said 5 lakh infiltrators entered Assam in 2023.",
      "language": "en"
    },
    "expected": {
      "claim_types": [
        "checkable_fact"
      ],
      "veracity": "unverifiable",
      "route_to_human": true
    },
    "bucket": "political_sensitive",
    "synthetic": true,
    "notes": "Inflammatory demographic claim; human review mandatory."
  },
  {
    "id": "eval-020",
    "input": {
      "text": "Video shows police beating protesters in Lucknow yesterday.",
      "language": "en"
    },
    "expected": {
      "claim_types": [
        "checkable_fact"
      ],
      "veracity": "unverifiable",
      "route_to_human": true
    },
    "bucket": "political_sensitive",
    "synthetic": true,
    "notes": "Potential communal flare-up content; human review mandatory."
  },
  {
    "id": "eval-021",
    "input": {
      "text": "चुनाव आयोग ने मतदान की तारीख बदल दी है।",
      "language": "hi"
    },
    "expected": {
      "claim_types": [
        "checkable_fact"
      ],
      "veracity": "unverifiable",
      "route_to_human": true
    },
    "bucket": "political_sensitive",
    "synthetic": true,
    "notes": "Election-integrity claim; human review mandatory."
  },
  {
    "id": "eval-022",
    "input": {
      "text": "The opposition leader was arrested on corruption charges on Tuesday.",
      "language": "en"
    },
    "expected": {
      "claim_types": [
        "checkable_fact"
      ],
      "veracity": "contradicted",
      "route_to_human": true
    },
    "bucket": "political_sensitive",
    "synthetic": true,
    "notes": "High-impact political claim; human review mandatory."
  },
  {
    "id": "eval-023",
    "input": {
      "text": "Exit polls project 300 seats for the ruling party.",
      "language": "en"
    },
    "expected": {
      "claim_types": [
        "prediction"
      ],
      "veracity": "unverifiable",
      "route_to_human": true
    },
    "bucket": "political_sensitive",
    "synthetic": true,
    "notes": "Forecast about an election; typed prediction plus human routing."
  },
  {
    "id": "eval-024",
    "input": {
      "text": "दंगे में 50 लोगों की मौत हुई, according to local reports.",
      "language": "hi-en"
    },
    "expected": {
      "claim_types": [
        "checkable_fact"
      ],
      "veracity": "unverifiable",
      "route_to_human": true
    },
    "bucket": "political_sensitive",
    "synthetic": true,
    "notes": "Hinglish communal-violence casualty claim; human review mandatory."
  },
  {
    "id": "eval-025",
    "input": {
      "text": "The EVMs were hacked in the 2024 election, an MLA claimed.",
      "language": "en"
    },
    "expected": {
      "claim_types": [
        "checkable_fact"
      ],
      "veracity": "contradicted",
      "route_to_human": true
    },
    "bucket": "political_sensitive",